Category,Long,Description,ImageButton,ImageOnly,IsFree,PurchaseLabel
ثقافة عامة,مجموعة الثقافة العامة,لا حدود لهذه المجموعة ففيها العلوم بشتى أنواعها ومختارات من المعرفة البشرية,btn_edu,img_edu,Y,product_edu
دين,مجموعة الدين,باقة مزهرة من العناوين البارزة في الثقافة الإسلامية,btn_relegion,img_relegion,Y,product_relegion
أكلات ومطاعم,مجموعة الأكلات والمطاعم,لا تلعب هذه المجموعة إلا والعشاء جاهز ففيها كل ما لذ وطاب من الأكلات ومجموعة كبيرة من المطاعم المفضلة عالمياً,btn_food,img_food,N,product_food
رياضة,مجموعة الرياضة,هذه المجموعة تحتوي شخصيات وأندية رياضية وكل ما يتعلق بجميع الرياضات محلياً وعالمياً,btn_sport,img_sport,N,product_sport
الشاشة,مجموعة الشاشة,مجموعة مختارة من أبرز المسلسلات والأفلام العربية والعالمية ونجومها اللامعين,btn_tv,img_tv,N,product_tv
ماركات,مجموعة الماركات,عالم كبير من ماركات الأزياء والتقنية والسيارات تختبر معرفتكم التجارية,btn_brands,img_brands,N,product_brands
سياحة,مجموعة السياحة,لهواة السفر والجغرافيا، تحتوي المجموعة على بلدان ووجهات سياحية معروفة محلياً وعالمياً,btn_travel,img_travel,N,product_travel
كرتون,مجموعة أفلام الكرتون,تحتوي على عناوين وشخصيات أفلام كرتون الزمن الجميل والحديث بالإضافة للآنمي,btn_cartoon,img_cartoon,N,product_cartoon